{
  "specversion": "1.0",
  "id": "cs_01HY3KXSECURITY001",
  "vendor_id": "npm:express",
  "category": "security",
  "severity": "critical",
  "title": "CVE-2025-29999: Path traversal in static file serving",
  "summary": "A path traversal vulnerability in Express's static file middleware allows an attacker to read arbitrary files from the server filesystem by crafting a request with encoded path separators. All applications using express.static() with user-controlled paths are affected. Patch to 4.21.3 immediately.",
  "published_at": "2026-04-10T09:00:00Z",
  "source_type": "crawled",
  "confidence_score": 0.97,
  "effective_date": "2026-04-10",
  "source_url": "https://github.com/advisories/GHSA-xxxx-xxxx-xxxx",
  "affected_versions": ">=4.0.0 <4.21.3",
  "fixed_in_version": "4.21.3",
  "cve_id": "CVE-2025-29999",
  "cvss_score": 9.1,
  "cvss_vector": "CVSS:3.1/AV:N/AC:L/PR:N/UI:N/S:U/C:H/I:N/A:N",
  "migration_hint": "Upgrade to express 4.21.3 or later. No code changes required - the patch is drop-in.",
  "migration_url": "https://github.com/expressjs/express/releases/tag/4.21.3",
  "action_required": true,
  "recommended_reviewers": ["security", "engineering"],
  "tags": ["path-traversal", "static-files", "rce-risk"]
}
