{
  "specversion": "1.0",
  "id": "cs_01HY3KXCOSMETIC01",
  "vendor_id": "npm:lodash",
  "category": "cosmetic",
  "severity": "informational",
  "title": "README: updated installation instructions for ESM",
  "summary": "The lodash README was updated to clarify ESM import syntax for Node.js 18+. No code changes, no behavior changes. The update adds a note that lodash-es should be used for tree-shakeable ESM imports.",
  "published_at": "2026-04-05T16:00:00Z",
  "source_type": "crawled",
  "confidence_score": 0.99,
  "effective_date": "2026-04-05",
  "source_url": "https://github.com/lodash/lodash/blob/main/README.md",
  "action_required": false,
  "tags": ["docs", "esm", "readme"]
}
